{
  "$schema": "https://json-schema.org/draft/2020-12/schema",
  "$id": "https://janus-lang.org/schemas/registry/v1/archive-manifest.schema.json",
  "title": "Janus registry v1 archive manifest",
  "type": "object",
  "additionalProperties": false,
  "required": ["protocolVersion", "package", "version", "entries"],
  "properties": {
    "protocolVersion": {"const": "1"},
    "package": {"type": "string", "pattern": "^[a-z][a-z0-9_-]{0,63}/[a-z][a-z0-9_-]{0,63}$"},
    "version": {"type": "string", "pattern": "^(0|[1-9][0-9]*)\\.(0|[1-9][0-9]*)\\.(0|[1-9][0-9]*)(?:-(?:0|[1-9][0-9]*|[0-9A-Za-z-]*[A-Za-z-][0-9A-Za-z-]*)(?:\\.(?:0|[1-9][0-9]*|[0-9A-Za-z-]*[A-Za-z-][0-9A-Za-z-]*))*)?(?:\\+[0-9A-Za-z-]+(?:\\.[0-9A-Za-z-]+)*)?$"},
    "entries": {
      "type": "array",
      "minItems": 1,
      "items": {
        "type": "object",
        "additionalProperties": false,
        "required": ["path", "sha256", "size"],
        "properties": {
          "path": {"type": "string", "pattern": "^(?:(?:src|tests|examples|docs)/(?!\\.{1,2}(?:/|$))[A-Za-z0-9._-]+(?:/(?!\\.{1,2}(?:/|$))[A-Za-z0-9._-]+)*|janus\\.toml|README\\.md|LICENSE|NOTICE)$"},
          "sha256": {"type": "string", "pattern": "^[0-9a-f]{64}$"},
          "size": {"type": "integer", "minimum": 0}
        }
      }
    }
  }
}
