{
  "protocolVersion": "1",
  "package": "acme/http",
  "version": "1.2.3",
  "entries": [
    {"path": "janus.toml", "sha256": "aaaaaaaaaaaaaaaaaaaaaaaaaaaaaaaaaaaaaaaaaaaaaaaaaaaaaaaaaaaaaaaa", "size": 128},
    {"path": "src/main.janus", "sha256": "bbbbbbbbbbbbbbbbbbbbbbbbbbbbbbbbbbbbbbbbbbbbbbbbbbbbbbbbbbbbbbbb", "size": 512},
    {"path": "README.md", "sha256": "cccccccccccccccccccccccccccccccccccccccccccccccccccccccccccccccc", "size": 256}
  ]
}
